{
  "$schema": "https://json-schema.org/draft/2020-12/schema",
  "$id": "https://raw.githubusercontent.com/nmetulev/winui-devex/main/protocol/wdxp.schema.json",
  "title": "WDXP protocol definition guard",
  "description": "Validates the hand-authored wdxp.v0.json (DAP-style single source of truth). Also serves as the IDE authoring aid via the $schema reference in the protocol file.",
  "type": "object",
  "required": ["protocol", "version", "stability", "framing", "errorCodes", "riskTiers", "types", "domains"],
  "additionalProperties": true,
  "properties": {
    "protocol": { "const": "wdxp" },
    "title": { "type": "string" },
    "version": { "type": "string", "pattern": "^[0-9]+\\.[0-9]+\\.[0-9]+$" },
    "stability": { "$ref": "#/$defs/stability" },
    "summary": { "type": "string" },
    "framing": {
      "type": "object",
      "required": ["transport", "rpc", "delimiter", "sessionModel"],
      "properties": {
        "transport": { "type": "string" },
        "rpc": { "const": "json-rpc-2.0" },
        "delimiter": { "const": "newline" },
        "sessionModel": { "const": "session-equals-connection" },
        "security": { "type": "string" }
      }
    },
    "errorCodes": {
      "type": "array",
      "minItems": 1,
      "items": {
        "type": "object",
        "required": ["code", "name", "category", "recoverable", "summary"],
        "properties": {
          "code": { "type": "integer" },
          "name": { "type": "string", "pattern": "^[A-Z][A-Za-z0-9]*$" },
          "category": { "type": "string" },
          "recoverable": { "type": "boolean" },
          "summary": { "type": "string" }
        },
        "additionalProperties": false
      }
    },
    "riskTiers": {
      "type": "array",
      "minItems": 1,
      "items": {
        "type": "object",
        "required": ["tier", "level", "consent", "summary"],
        "properties": {
          "tier": { "$ref": "#/$defs/riskTier" },
          "level": { "type": "integer", "minimum": 0 },
          "consent": { "type": "string", "enum": ["session-grant", "explicit"] },
          "summary": { "type": "string" }
        },
        "additionalProperties": false
      }
    },
    "types": { "type": "array", "items": { "$ref": "#/$defs/typeDef" } },
    "domains": {
      "type": "array",
      "minItems": 1,
      "items": { "$ref": "#/$defs/domain" }
    }
  },
  "$defs": {
    "stability": { "type": "string", "enum": ["stable", "experimental", "deprecated"] },
    "riskTier": { "type": "string", "enum": ["read", "mutate-ephemeral", "structural", "persist", "privileged"] },
    "identifier": { "type": "string", "pattern": "^[A-Za-z][A-Za-z0-9]*$" },
    "field": {
      "type": "object",
      "required": ["name"],
      "properties": {
        "name": { "$ref": "#/$defs/identifier" },
        "type": { "type": "string", "enum": ["string", "integer", "number", "boolean", "object"] },
        "$ref": { "type": "string" },
        "array": { "type": "boolean" },
        "optional": { "type": "boolean" },
        "summary": { "type": "string" }
      },
      "oneOf": [
        { "required": ["type"] },
        { "required": ["$ref"] }
      ],
      "additionalProperties": false
    },
    "typeDef": {
      "type": "object",
      "required": ["id", "kind"],
      "properties": {
        "id": { "$ref": "#/$defs/identifier" },
        "kind": { "type": "string", "enum": ["enum", "object", "primitive"] },
        "summary": { "type": "string" },
        "values": { "type": "array", "items": { "type": "string" }, "minItems": 1 },
        "type": { "type": "string", "enum": ["string", "integer", "number", "boolean"] },
        "properties": { "type": "array", "items": { "$ref": "#/$defs/field" } }
      },
      "allOf": [
        { "if": { "properties": { "kind": { "const": "enum" } } }, "then": { "required": ["values"] } },
        { "if": { "properties": { "kind": { "const": "object" } } }, "then": { "required": ["properties"] } },
        { "if": { "properties": { "kind": { "const": "primitive" } } }, "then": { "required": ["type"] } }
      ],
      "additionalProperties": false
    },
    "command": {
      "type": "object",
      "required": ["name", "risk", "summary", "parameters", "returns"],
      "properties": {
        "name": { "$ref": "#/$defs/identifier" },
        "risk": { "$ref": "#/$defs/riskTier" },
        "stability": { "$ref": "#/$defs/stability" },
        "summary": { "type": "string" },
        "parameters": { "type": "array", "items": { "$ref": "#/$defs/field" } },
        "returns": { "type": "array", "items": { "$ref": "#/$defs/field" } }
      },
      "additionalProperties": false
    },
    "event": {
      "type": "object",
      "required": ["name", "summary", "parameters"],
      "properties": {
        "name": { "$ref": "#/$defs/identifier" },
        "stability": { "$ref": "#/$defs/stability" },
        "summary": { "type": "string" },
        "parameters": { "type": "array", "items": { "$ref": "#/$defs/field" } }
      },
      "additionalProperties": false
    },
    "domain": {
      "type": "object",
      "required": ["domain", "capability", "stability", "summary", "types", "commands", "events"],
      "properties": {
        "domain": { "$ref": "#/$defs/identifier" },
        "capability": { "type": "string", "pattern": "^[a-z][a-z0-9]*$" },
        "stability": { "$ref": "#/$defs/stability" },
        "summary": { "type": "string" },
        "types": { "type": "array", "items": { "$ref": "#/$defs/typeDef" } },
        "commands": { "type": "array", "items": { "$ref": "#/$defs/command" } },
        "events": { "type": "array", "items": { "$ref": "#/$defs/event" } }
      },
      "additionalProperties": false
    }
  }
}
