{
  "$schema": "./wdxp.schema.json",
  "protocol": "wdxp",
  "title": "WinUI Runtime DevTools Protocol",
  "version": "0.1.0",
  "stability": "experimental",
  "summary": "Canonical, CDP-shaped source of truth for the WinUI design-time engine. Hand-authored (DAP-style); the CLI command-graph and docs facades are generated from this file. Grounded in the proven substrate: the proven transport (newline JSON-RPC 2.0 + server notifications) is the envelope; the proof-of-concept's live ops (findname/children/getchild/setprop/census) are the first VisualTree/Property/Source methods.",
  "framing": {
    "transport": "named-pipe",
    "pipeNameTemplate": "wdxp-<targetPid>",
    "security": "CurrentUserOnly",
    "rpc": "json-rpc-2.0",
    "delimiter": "newline",
    "sessionModel": "session-equals-connection",
    "negotiationMethod": "WDXP.negotiate",
    "cancellationMethod": "WDXP.cancel",
    "reference": "See envelope.md for the normative framing spec."
  },
  "errorCodes": [
    { "code": -32700, "name": "ParseError", "category": "jsonrpc", "recoverable": false, "summary": "Invalid JSON was received." },
    { "code": -32600, "name": "InvalidRequest", "category": "jsonrpc", "recoverable": false, "summary": "The JSON sent is not a valid Request object." },
    { "code": -32601, "name": "MethodNotFound", "category": "jsonrpc", "recoverable": false, "summary": "The method does not exist / is not available." },
    { "code": -32602, "name": "InvalidParams", "category": "jsonrpc", "recoverable": false, "summary": "Invalid method parameters." },
    { "code": -32603, "name": "InternalError", "category": "jsonrpc", "recoverable": false, "summary": "Internal JSON-RPC error." },
    { "code": -32000, "name": "TargetLost", "category": "target", "recoverable": false, "summary": "The attached app exited or its dispatcher is gone. Re-attach." },
    { "code": -32001, "name": "StaleHandle", "category": "visualtree", "recoverable": true, "summary": "Node handle generation mismatch. Re-enumerate to refresh handles." },
    { "code": -32002, "name": "NotOnDispatcher", "category": "engine", "recoverable": true, "summary": "A mutation was routed off the UI DispatcherQueue (RPC_E_WRONG_THREAD analog). The engine must marshal; clients should never see this." },
    { "code": -32003, "name": "CapabilityUnsupported", "category": "core", "recoverable": true, "summary": "The requested capability/version was not negotiated. Negotiation returns this cleanly; never crash." },
    { "code": -32004, "name": "Unauthorized", "category": "security", "recoverable": true, "summary": "The session lacks a grant for this command family or the token expired." },
    { "code": -32005, "name": "RefusedUnsafe", "category": "hotreload", "recoverable": true, "summary": "The engine classified the edit as unsafe to apply in place and refused rather than risk corruption." },
    { "code": -32006, "name": "UnreachableGate", "category": "hotreload", "recoverable": true, "summary": "A required apply gate (e.g. render verification) could not be reached." },
    { "code": -32007, "name": "SourceUnavailable", "category": "source", "recoverable": true, "summary": "No source provenance for this element (runtime-only, or spans stripped). Not an error condition to fear \u2014 use the anchor." },
    { "code": -32008, "name": "Cancelled", "category": "core", "recoverable": true, "summary": "The request was cancelled via WDXP.cancel." }
  ],
  "types": [
    { "id": "Confidence", "kind": "enum", "values": ["exact", "high", "low", "none"], "summary": "Grades any best-effort resolution (source spans, identity, diagnostics). Ordered strongest\u2192weakest." },
    { "id": "Outcome", "kind": "enum", "values": ["applied", "applied-inert", "reloaded", "needs-restart"], "summary": "The four-outcome classifier every mutating result reports. Honesty invariant: never report a stronger outcome than actually achieved." },
    { "id": "RiskTier", "kind": "enum", "values": ["read", "mutate-ephemeral", "structural", "persist", "privileged"], "summary": "Command risk tier. Drives consent, audit, and grant policy (Security domain). Every command declares one." }
  ],
  "riskTiers": [
    { "tier": "read", "level": 0, "consent": "session-grant", "summary": "No app-visible mutation: enumerations, reads, subscriptions, resolution." },
    { "tier": "mutate-ephemeral", "level": 1, "consent": "session-grant", "summary": "Live runtime override that is NOT persisted (a set-property preview)." },
    { "tier": "structural", "level": 2, "consent": "session-grant", "summary": "Adds/removes/moves live elements or commits a runtime transaction." },
    { "tier": "persist", "level": 3, "consent": "explicit", "summary": "Writes back to source on disk." },
    { "tier": "privileged", "level": 4, "consent": "explicit", "summary": "Auth, grants, or target-allowlist changes." }
  ],
  "domains": [
    {
      "domain": "WDXP",
      "capability": "core",
      "stability": "stable",
      "summary": "Protocol built-ins present on every session before any capability is negotiated.",
      "types": [
        { "id": "Capability", "kind": "object", "summary": "A negotiable capability and the version the peer offers.", "properties": [
          { "name": "name", "type": "string", "summary": "Capability id, e.g. 'visualtree'." },
          { "name": "version", "type": "string", "summary": "SemVer of the capability contract." },
          { "name": "stability", "type": "string", "summary": "stable | experimental." }
        ]}
      ],
      "commands": [
        { "name": "negotiate", "risk": "read", "stability": "stable", "summary": "Exchange supported capabilities/versions. Session = connection; call this first. Unknown capabilities return CapabilityUnsupported, never a crash.",
          "parameters": [
            { "name": "client", "type": "string", "summary": "Client identity string (host id), e.g. 'winapp-vsc/1.2.0'." },
            { "name": "capabilities", "$ref": "Capability", "array": true, "summary": "Capabilities the client wants, with the max version it understands." }
          ],
          "returns": [
            { "name": "agreed", "$ref": "Capability", "array": true, "summary": "The intersection the engine will honor for this session." },
            { "name": "protocolVersion", "type": "string", "summary": "Engine protocol version (this file's version)." }
          ]
        },
        { "name": "cancel", "risk": "read", "stability": "stable", "summary": "Request cancellation of an in-flight request by its JSON-RPC id. Best-effort; long reads and applies honor it at safe points.",
          "parameters": [ { "name": "id", "type": "string", "summary": "The JSON-RPC id of the request to cancel." } ],
          "returns": [ { "name": "cancelled", "type": "boolean", "summary": "True if a matching in-flight request was found and signaled." } ]
        }
      ],
      "events": [
        { "name": "sessionClosing", "summary": "The engine is tearing the session down (target lost or shutdown). Clients should stop issuing commands.",
          "parameters": [ { "name": "reason", "type": "string", "summary": "target-lost | shutdown | unauthorized." } ] }
      ]
    },
    {
      "domain": "Target",
      "capability": "target",
      "stability": "stable",
      "summary": "Discover, attach to, and track the lifecycle of a running WinUI app (target). Session = connection; attach binds this connection to one target.",
      "types": [
        { "id": "TargetId", "kind": "primitive", "type": "string", "summary": "Opaque, stable-for-process target id." },
        { "id": "PackageIdentity", "kind": "object", "summary": "Packaged vs unpackaged identity of a target.", "properties": [
          { "name": "packaged", "type": "boolean", "summary": "True if MSIX-packaged." },
          { "name": "aumid", "type": "string", "optional": true, "summary": "Application User Model ID (packaged only)." },
          { "name": "familyName", "type": "string", "optional": true, "summary": "Package family name (packaged only)." },
          { "name": "path", "type": "string", "optional": true, "summary": "Executable path (unpackaged) or install path." }
        ]},
        { "id": "DispatcherAffinity", "kind": "object", "summary": "The UI thread / DispatcherQueue all mutations MUST marshal to (threading contract). Reads may run off-thread; mutations may not.", "properties": [
          { "name": "threadId", "type": "integer", "summary": "OS thread id of the UI thread." },
          { "name": "queueId", "type": "string", "optional": true, "summary": "Opaque DispatcherQueue id when multiple roots exist." }
        ]},
        { "id": "Target", "kind": "object", "summary": "A discovered or attached target.", "properties": [
          { "name": "targetId", "$ref": "TargetId" },
          { "name": "pid", "type": "integer", "summary": "OS process id." },
          { "name": "title", "type": "string", "summary": "Best-effort window/app title." },
          { "name": "package", "$ref": "PackageIdentity" },
          { "name": "rootCount", "type": "integer", "summary": "Number of XamlRoots/windows." },
          { "name": "protocolVersion", "type": "string", "summary": "wdxp version the in-app engine speaks." }
        ]},
        { "id": "LostReason", "kind": "enum", "values": ["closed", "crashed", "detached", "timeout"], "summary": "Why a target went away." }
      ],
      "commands": [
        { "name": "list", "risk": "read", "stability": "stable", "summary": "Enumerate attachable WinUI targets on this machine for the current user.",
          "parameters": [],
          "returns": [ { "name": "targets", "$ref": "Target", "array": true } ]
        },